book,chapter,verse_number,text
Leviticus,20,12,"At kapag ang isang lalaki ay sumiping sa kanyang manugang na babae, sila ay kapwa papatayin; sila'y gumawa ng kahalayan, ang kanilang dugo ay nasa kanila."
Leviticus,20,13,"Kapag ang isang lalaki ay sumiping sa kapwa lalaki, na gaya ng pagsiping sa babae, sila ay kapwa nakagawa ng bagay na karumaldumal, tiyak na sila'y papatayin, ang kanilang dugo ay nasa kanila."
Leviticus,20,14,"Kung ang isang lalaki ay mag-asawa sa isang babae at sa kanyang ina, ito ay kasamaan. Kanilang susunugin siya at sila upang huwag magkaroon ng kasamaan sa inyong kalagitnaan."
Leviticus,20,15,"Kapag ang isang lalaki ay sumiping sa hayop, siya ay tiyak na papatayin, at papatayin din ninyo ang hayop."
Leviticus,20,16,"Kung ang isang babae ay lumapit sa alinmang hayop at nakipagtalik dito, papatayin mo ang babae at ang hayop; sila'y tiyak na papatayin at ang kanilang dugo ay nasa kanila."
Leviticus,20,17,"“Kung kunin ng isang lalaki ang kanyang kapatid na babae, na anak ng kanyang ama o anak ng kanyang ina, at kanyang makita ang kanyang kahubaran, at makita ng babae ang kahubaran niya, ito ay isang bagay na kahiyahiya. Sila'y ititiwalag sa paningin ng mga anak ng kanilang bayan, sapagkat inilitaw niya ang kahubaran ng kanyang kapatid na babae; kanyang pananagutan ang kasamaan niya."
Leviticus,20,18,"Kung ang isang lalaki ay sumiping sa isang babaing may regla, at ilitaw ang kahubaran niya; kanyang hinubaran ang kanyang daloy at kanyang pinalitaw ang daloy ng kanyang dugo; at sila'y kapwa ititiwalag sa kalagitnaan ng kanilang bayan."
Leviticus,20,19,"At huwag mong ililitaw ang kahubaran ng kapatid na babae ng iyong ina, ni ng kapatid na babae ng iyong ama, sapagkat hinubaran niya ang kanyang malapit na kamag-anak; sila ay kapwa mananagot ng kanilang kasamaan."
Leviticus,20,20,"Kung ang isang lalaki ay sumiping sa asawa ng kanyang amain, kanyang inilitaw ang kahubaran ng kanyang amain. Pananagutan nila ang kanilang kasalanan at mamamatay silang walang anak."
Leviticus,20,21,"Kung ang isang lalaki ay makisama sa asawa ng kanyang kapatid na lalaki, ito ay karumihan; kanyang inilitaw ang kahubaran ng kanyang kapatid na lalaki kaya't mabubuhay silang walang anak. Utos upang Tuparin ang Batas ng Kalinisan"
Leviticus,20,22,"“Tuparin ninyo ang lahat ng aking mga tuntunin at mga batas, at gawin ninyo ang mga iyon upang huwag kayong isuka ng lupain na aking pagdadalhan sa inyo na inyong tatahanan."
Leviticus,20,23,"Huwag kayong lalakad ng ayon sa mga kaugalian ng mga bansang aking palalayasin sa harapan ninyo, sapagkat ang lahat ng kasamaang ito ay ginawa nila, at ako ay nasusuklam sa kanila."
Leviticus,20,24,"Subalit sinabi ko na sa inyo, ‘Tiyak na mamanahin ninyo ang lupain nila, at ibibigay ko sa inyo upang inyong manahin, isang lupaing binubukalan ng gatas at pulot.’ Ako ang Panginoon ninyong Diyos na nagbukod sa inyo sa mga bayan."
Leviticus,20,25,"Inyong lalagyan ng pagkakaiba ang hayop na malinis at ang marumi, at ang ibong marumi at ang malinis. Huwag ninyong gagawing karumaldumal ang inyong pagkatao sa hayop o sa ibon, o sa anumang bagay na umuusad sa lupa na inihiwalay ko sa inyo bilang mga marurumi."
Leviticus,20,26,"Kayo'y magpakabanal sa akin, sapagkat akong Panginoon ay banal, at kayo'y ibinukod ko sa mga bayan, upang kayo'y maging akin."
Leviticus,20,27,"“Ang isang lalaki o ang isang babae na sumasangguni sa masasamang espiritu, o mangkukulam, ay tiyak na papatayin. Sila'y babatuhin hanggang mamatay, ang kanilang dugo ay pasan nila.”"
Leviticus,21,1,"Sinabi ng Panginoon kay Moises, “Sabihin mo ang ganito sa mga pari na mga anak ni Aaron: Hindi dapat dungisan ng sinuman ang kanyang sarili nang dahil sa patay na kasama ng kanyang bayan,"
Leviticus,21,2,"maliban sa kanyang malapit na kamag-anak: sa kanyang ina, ama, anak na lalaki at babae, kapatid na lalaki,"
Leviticus,21,3,"at sa kanyang kapatid na dalaga na malapit sa kanya, sapagkat siya ay walang asawa, ay maaaring madungisan niya ang kanyang sarili dahil sa dalaga."
Leviticus,21,4,Hindi niya dapat dungisan ang kanyang sarili bilang isang asawang lalaki sa gitna ng kanyang bayan at malapastanganan ang sarili.
Leviticus,21,5,"Huwag silang gagawa ng kalbong bahagi sa kanilang ulo, o gugupitin man ang dulo ng kanilang balbas, o hihiwaan man ang kanilang laman."
Leviticus,21,6,"Sila'y magiging banal sa kanilang Diyos, at huwag nilang lalapastanganin ang pangalan ng kanilang Diyos; sapagkat sila ang nag-aalay ng mga handog sa Panginoon na pinaraan sa apoy, na tinapay ng kanilang Diyos, kaya't sila'y magiging banal."
Leviticus,21,7,"Huwag silang mag-aasawa ng isang babaing upahan o babaing nadungisan, ni mag-aasawa sa isang babaing hiwalay na sa kanyang asawa, sapagkat ang pari ay banal sa kanyang Diyos."
Leviticus,21,8,"Siya ay iyong ituturing na banal, sapagkat siya ang naghahandog ng tinapay ng inyong Diyos. Siya'y magiging banal sa inyo; sapagkat akong Panginoon na nagpapabanal sa inyo ay banal."
Leviticus,21,9,Kapag dinungisan ng anak na babae ng isang pari ang kanyang sarili sa pamamagitan ng pagpapaupa ay kanyang nilalapastangan ang kanyang ama; siya'y susunugin sa apoy.
Leviticus,21,10,"“Ang pari na pangunahin sa kanilang magkakapatid, na binuhusan ng langis ang ulo at ang kamay, at itinalaga upang magsuot ng kasuotan ng pari, hindi dapat maglugay ng kanyang buhok, ni sirain ang kanyang damit."
Leviticus,21,11,"Huwag siyang lalapit sa anumang bangkay, ni dungisan ang kanyang sarili, maging dahil sa kanyang ama, o dahil sa kanyang ina;"
Leviticus,21,12,"ni lalabas siya sa santuwaryo, ni lalapastanganin ang santuwaryo ng kanyang Diyos; sapagkat ang pagtalaga ng langis na pambuhos ng kanyang Diyos ay nasa kanya: Ako ang Panginoon ."
Leviticus,21,13,Siya'y mag-aasawa sa isang dalagang birhen.
Leviticus,21,14,"Hindi siya mag-aasawa sa isang balo, o sa hiniwalayan, o sa isang babaing nadungisan, o sa isang upahang babae; kundi kukuha siya ng isang dalagang malinis sa kanyang sariling bayan bilang asawa."
Leviticus,21,15,"Upang hindi niya malapastangan ang kanyang mga anak sa gitna ng kanyang mga kamag-anak, sapagkat ako ang Panginoon na nagpapabanal sa kanya.” Karapatan sa Pagkapari"
Leviticus,21,16,"At nagsalita ang Panginoon kay Moises, na sinasabi,"
Leviticus,21,17,“Sabihin mo kay Aaron: Sinuman sa iyong mga anak sa buong panahon ng kanilang salinlahi na may kapintasan ay hindi maaaring lumapit upang maghandog ng tinapay sa kanyang Diyos.
Leviticus,21,18,"Sapagkat sinumang mayroong kapintasan ay huwag lalapit, ang taong bulag, pilay, nasira ang mukha, sobrang mahaba ang paa o kamay;"
Leviticus,21,19,ang taong nabalian ng paa o nabalian ng kamay;
Leviticus,21,20,"kuba, unano, ang taong may kapansanan sa kanyang mata, sakit ng pangangati, galisin, o nadurog ang itlog."
Leviticus,21,21,Walang tao mula sa binhi ni Aaron na pari na mayroong kapintasan ang lalapit upang mag-alay ng mga handog sa Panginoon na pinaraan sa apoy yamang siya'y may kapintasan; siya'y huwag lalapit upang mag-alay ng tinapay sa kanyang Diyos.
Leviticus,21,22,"Makakakain siya ng tinapay ng kanyang Diyos, ang kabanal-banalan at ang mga bagay na banal;"
Leviticus,21,23,"subalit hindi siya makakalapit sa tabing, o lalapit man sa dambana, sapagkat siya'y may kapintasan upang hindi niya malapastangan ang aking mga santuwaryo; sapagkat ako ang Panginoon na nagpapabanal sa kanila.”"
Leviticus,21,24,"Gayon ang sinabi ni Moises kay Aaron at sa kanyang mga anak, at sa lahat ng mga anak ni Israel."
Leviticus,22,1,"At nagsalita ang Panginoon kay Moises, na sinasabi,"
Leviticus,22,2,"“Sabihin mo kay Aaron at sa kanyang mga anak na sila'y magsilayo sa mga banal na bagay ng mga anak ni Israel, na kanilang itinalaga sa akin upang huwag nilang lapastanganin ang aking banal na pangalan: Ako ang Panginoon ."
Leviticus,22,3,"Sabihin mo sa kanila, ‘Sinuman sa lahat ng inyong binhi sa buong panahon ng inyong salinlahi na lumapit sa mga banal na bagay na itinalaga ng mga anak ni Israel sa Panginoon na nasa kalagayang marumi, ang taong iyon ay ititiwalag sa aking harapan: Ako ang Panginoon ."
Leviticus,22,4,"Sinuman sa binhi ni Aaron na may ketong o may tulo ay hindi kakain ng mga banal na bagay hanggang siya'y maging malinis. At ang humipo ng alinmang bagay na marumi dahil sa patay, o lalaking nilabasan ng binhi nito,"
Leviticus,22,5,"o sinumang humipo ng anumang gumagapang na makakapagparumi sa kanya o humipo sa lalaking makakapagparumi sa kanya, sa pamamagitan ng alinman sa kanyang karumihan,"
Leviticus,22,6,"ang tao na humipo sa gayon ay magiging marumi hanggang sa paglubog ng araw. Huwag siyang kakain ng mga banal na bagay, kundi paliliguan niya ang kanyang katawan sa tubig."
Leviticus,22,7,"Pagkalubog ng araw, siya ay magiging malinis at pagkatapos ay makakakain na siya ng mga banal na bagay, sapagkat iyon ay kanyang pagkain."
Leviticus,22,8,"Hindi niya kakainin ang anumang kusang namatay o nilapa ng hayop, sapagkat marurumihan niya ang kanyang sarili sa pamamagitan nito: Ako ang Panginoon .’"
Leviticus,22,9,"Kaya't tutuparin nila ang aking bilin, at hindi nila iyon ipagkakasala, upang sila ay huwag mamatay kapag kanilang nilapastangan ito: Ako ang Panginoon na nagpapabanal sa kanila."
Leviticus,22,10,"“Ang isang taga-ibang bayan ay huwag kakain ng mga banal na bagay; sinumang manunuluyan sa pari, o aliping upahan niya ay huwag kakain ng banal na bagay."
Leviticus,22,11,"Ngunit kung ang pari ay bumili ng isang tao sa pamamagitan ng kanyang salapi, siya ay makakakain din nito; gayundin ang ipinanganak sa kanyang bahay ay makakakain ng kanyang tinapay."
Leviticus,22,12,"Kung ang isang anak na babae ng pari ay mag-asawa sa isang dayuhan, ang babae ay hindi makakakain ng handog ng mga banal na bagay."
Leviticus,22,13,"Subalit kung ang anak na babae ng pari ay balo o hiwalay sa asawa at walang anak at bumalik sa bahay ng kanyang ama na gaya rin nang kanyang kabataan, siya ay makakakain ng tinapay ng kanyang ama, ngunit ang sinumang dayuhan ay hindi makakakain niyon."
Leviticus,22,14,"At kung ang sinumang lalaki ay magkamaling kumain ng banal na bagay, iyon ay kanyang daragdagan ng ikalimang bahagi at ibibigay iyon sa pari kasama ng banal na bagay."
Leviticus,22,15,"Huwag lalapastanganin ng mga pari ang mga banal na bagay ng mga anak ni Israel, na kanilang inihahandog sa Panginoon ;"
Leviticus,22,16,sapagkat iyon ay magbubunga ng pagpasan nila ng kasamaan at pagkakasala sa pamamagitan ng pagkain ng kanilang mga banal na bagay; sapagkat ako ang Panginoon na nagpapabanal sa kanila.”
Leviticus,22,17,"At nagsalita ang Panginoon kay Moises, na sinasabi,"
Leviticus,22,18,"“Sabihin mo kay Aaron, sa kanyang mga anak, at sa lahat ng mga anak ni Israel: Sinuman sa sambahayan ni Israel o sa mga dayuhan sa Israel, na maghahandog ng kanyang alay, maging kabayaran sa isang panata o bilang inialay sa Panginoon bilang handog na sinusunog,"
Leviticus,22,19,"upang tanggapin, ang inyong ihahandog ay isang lalaki na walang kapintasan, mula sa mga toro, sa mga tupa, o sa mga kambing."
Leviticus,22,20,"Huwag ninyong ihahandog ang anumang may kapintasan, sapagkat ito ay hindi tatanggapin para sa inyo."
Leviticus,22,21,"At kapag ang isang tao ay naghandog sa Panginoon ng handog pangkapayapaan, sa pagtupad ng isang panata o kaya'y kusang-loob na handog mula sa bakahan o sa kawan, ito ay kailangang sakdal upang matanggap; ito ay kailangang walang kapintasan."
Leviticus,22,22,"Ang bulag, may bali, may kapansanan, may tulo, may pangangati, o may galis, ay huwag ninyong ihahandog sa Panginoon , ni gagawin ang mga ito bilang handog sa Panginoon na pinaraan sa apoy sa ibabaw ng dambana."
Leviticus,22,23,"Ang toro o tupa na may bahaging napakahaba o napakaikli ay maaari mong ialay bilang kusang-loob na handog, subalit hindi matatanggap para sa isang panata."
Leviticus,22,24,"Anumang hayop na nasira ang kasarian, nadurog, o naputol ay huwag ninyong ihahandog sa Panginoon , o iaalay sa loob ng inyong lupain."
Leviticus,22,25,"Huwag ninyong ihahandog bilang pagkain ng inyong Diyos ang anumang gayong hayop na nakuha mula sa isang dayuhan, yamang ang mga ito ay may kapintasan dahil sa kanilang kapansanan; hindi iyon tatanggapin para sa inyo.”"
Leviticus,22,26,"At nagsalita ang Panginoon kay Moises, na sinasabi,"
Leviticus,22,27,"“Kapag ipinanganak ang isang baka, tupa, o kambing, ito ay mananatili sa kanyang ina sa loob ng pitong araw; at mula sa ikawalong araw hanggang sa haharapin ito ay tatanggapin bilang alay, handog na pinaraan sa apoy para sa Panginoon ;"
Leviticus,22,28,"subalit huwag ninyong papatayin sa gayon ding araw ang baka, o tupa at ang kanyang anak."
Leviticus,22,29,"Kapag kayo'y maghahandog ng handog na pasasalamat sa Panginoon , iaalay ninyo ito upang kayo ay tanggapin;"
Leviticus,22,30,"at ito ay kakainin sa araw ding iyon, huwag kayong magtitira ng anuman hanggang sa umaga: Ako ang Panginoon ."
Leviticus,22,31,"“Kaya't inyong iingatan ang aking mga utos, at inyong tuparin ang mga iyon: Ako ang Panginoon ."
Leviticus,22,32,"Huwag ninyong lalapastanganin ang aking banal na pangalan; kundi ako'y pakakabanalin sa bayan ng Israel; ako ang Panginoon na nagpapabanal sa inyo,"
Leviticus,22,33,"na naglabas sa inyo mula sa lupain ng Ehipto, upang ako'y maging inyong Diyos: Ako ang Panginoon .”"
Leviticus,23,1,"At nagsalita ang Panginoon kay Moises, na sinasabi,"
Leviticus,23,2,“Magsalita ka sa mga anak ni Israel at sabihin mo sa kanila: Ito ang mga takdang kapistahan sa Panginoon na inyong ipahahayag bilang mga banal na pagpupulong.
Leviticus,23,3,"Anim na araw na gagawin ang mga gawain, subalit ang ikapitong araw ay Sabbath na ganap na kapahingahan, isang banal na pagpupulong. Huwag kayong gagawa ng anumang gawain; ito ay Sabbath sa Panginoon sa lahat ng inyong mga paninirahan."
Leviticus,23,4,"“Ito ang mga takdang kapistahan sa Panginoon , mga banal na pagpupulong na inyong ipagdiriwang sa takdang panahon. Ang Paskuwa at Tinapay na Walang Pampaalsa"
Leviticus,23,5,"“Sa ikalabing-apat na araw ng unang buwan, sa paglubog ng araw, ay ang Paskuwa ng Panginoon ."
Leviticus,23,6,Ang ikalabinlimang araw ng buwang ito ay Kapistahan ng Tinapay na Walang Pampaalsa sa Panginoon . Kakain kayo ng tinapay na walang pampaalsa sa loob ng pitong araw.
Leviticus,23,7,Sa unang araw ay magkakaroon kayo ng banal na pagpupulong; huwag kayong gagawa ng anumang mabigat na gawain.
Leviticus,23,8,Kayo ay maghahandog sa Panginoon sa loob ng pitong araw ng handog na pinaraan sa apoy; at ang ikapitong araw ay magiging banal na pagpupulong. Huwag kayong gagawa ng anumang mabigat na gawain.”
Leviticus,23,9,"At nagsalita ang Panginoon kay Moises, na sinasabi,"
Leviticus,23,10,"“Magsalita ka sa mga anak ni Israel, at sabihin mo sa kanila: Kapag kayo'y dumating sa lupain na aking ibinibigay sa inyo, at inyong nagapas na ang ani niyon, ay dalhin ninyo sa pari ang unang bunga ng inyong inani."
Leviticus,23,11,"Iwawagayway niya ang bigkis sa harapan ng Panginoon upang kayo'y tanggapin; sa kinabukasan pagkatapos ng Sabbath, ito ay iwawagayway ng pari."
Leviticus,23,12,"At ikaw ay maghahandog ng isang taong gulang na kordero na walang kapintasan, sa araw na iyong iwagayway ang bigkis bilang handog na sinusunog sa Panginoon ."
Leviticus,23,13,"Ang handog na butil ay magiging dalawang ikasampung bahagi ng isang efa ng pinong harina na hinaluan ng langis, isang handog sa Panginoon na pinaraan sa apoy na may mabangong samyo. Ang handog na inumin na kasama nito ay alak na ikaapat na bahagi ng isang hin. Kapistahan ng Pag-aani"
Leviticus,23,14,"Huwag kayong kakain ng tinapay at trigong sinangag, ni uhay na bago, hanggang sa araw na ito, hanggang sa inyong madala ang handog sa inyong Diyos. Ito ay tuntunin magpakailanman sa buong panahon ng inyong salinlahi, sa lahat ng inyong mga tirahan."
Leviticus,23,15,"“Mula sa kinabukasan, pagkalipas ng Sabbath mula sa araw na inyong dalhin ang bigkis na handog na iwinawagayway, ay bibilang kayo ng pitong buong linggo."
Leviticus,23,16,"Hanggang sa kinabukasan pagkalipas ng ikapitong Sabbath, bibilang kayo ng limampung araw; pagkatapos ay mag-aalay kayo ng handog na bagong butil sa Panginoon ."
Leviticus,23,17,"Mula sa inyong mga tahanan ay magdadala kayo ng dalawang tinapay upang iwagayway, na ang bawat isa ay dalawang ikasampung bahagi ng isang efa na mula sa piling harina, at lulutuin na may pampaalsa bilang unang bunga sa Panginoon ."
Leviticus,23,18,"Bukod sa tinapay, maghahandog kayo ng pitong kordero na isang taong gulang na walang kapintasan, at ng isang guyang toro at ng dalawang tupang lalaki. Ang mga ito ay magiging handog na sinusunog sa Panginoon , kasama ng kanilang butil na handog, at ng kanilang mga handog na inumin, isang handog na pinaraan sa apoy na mabangong samyo sa Panginoon ."
Leviticus,23,19,"Maghahandog din kayo ng isang kambing na lalaki bilang handog pangkasalanan, at ng dalawang korderong lalaki na isang taong gulang bilang alay na mga handog pangkapayapaan."
Leviticus,23,20,"Ang mga iyon ay iwawagayway ng pari kasama ng tinapay ng mga unang bunga, bilang handog na iwinawagayway sa harapan ng Panginoon , kasama ng dalawang kordero; ang mga iyon ay magiging banal sa Panginoon para sa pari."
Leviticus,23,21,Ikaw ay magpapahayag sa araw ding iyon; ito ay banal na pagtitipon sa inyo; huwag kayong gagawa ng anumang mabigat na gawain. Ito ay walang hanggang tuntunin sa lahat ng inyong mga tahanan sa buong panahon ng inyong salinlahi.
Leviticus,23,22,"“Kapag inyong ginapas ang ani sa inyong lupain, ay huwag ninyong gagapasan hanggang sa mga sulok ng inyong bukid; huwag ninyong titipunin ang mga nalaglag sa inyong pag-aani. Iiwan ninyo ang mga iyon para sa dukha at sa dayuhan: Ako ang Panginoon ninyong Diyos.” Pista ng mga Trumpeta"
Leviticus,23,23,"At nagsalita ang Panginoon kay Moises, na sinasabi,"
Leviticus,23,24,"“Magsalita ka sa mga anak ni Israel: Sa unang araw ng ikapitong buwan, ay magkakaroon kayo ng unang araw ng ganap na kapahingahan, isang banal na pagpupulong na ipinagdiriwang sa pamamagitan ng tunog ng mga trumpeta."
Leviticus,23,25,Kayo'y huwag gagawa ng anumang mabigat na gawain at kayo'y mag-aalay ng handog sa Panginoon na pinaraan sa apoy.” Ang Araw ng Pagtubos
Leviticus,23,26,"At nagsalita ang Panginoon kay Moises, na sinasabi,"
Leviticus,23,27,"“Gayundin, ang ikasampung araw ng ikapitong buwan ay araw ng pagtubos. Magkakaroon kayo ng banal na pagpupulong, magpakumbaba kayo, at mag-alay kayo ng handog sa Panginoon na pinaraan sa apoy."
Leviticus,23,28,"Huwag kayong gagawa ng anumang gawa sa araw ding ito, sapagkat ito ay araw ng pagtubos, upang gumawa ng pagtubos para sa inyo sa harapan ng Panginoon ninyong Diyos."
Leviticus,23,29,Sapagkat sinumang tao na hindi magpakumbaba sa araw ding ito ay ititiwalag sa kanyang bayan.
Leviticus,23,30,At sinumang tao na gumawa ng anumang gawa sa araw ding ito ay pupuksain ko sa kalagitnaan ng kanyang bayan.
Leviticus,23,31,Kayo'y huwag gagawa ng anumang gawa; ito ay isang walang hanggang tuntunin sa buong panahon ng inyong salinlahi sa lahat ng inyong tirahan.
Leviticus,23,32,"Ito ay magiging ganap na kapahingahan sa inyo, at kayo'y magpapakumbaba; sa ikasiyam na araw ng buwan sa hapon, mula sa paglubog ng araw hanggang sa paglubog ng araw ay ipapangilin ninyo ang inyong Sabbath.” Kapistahan ng mga Kubol"
Leviticus,23,33,"At nagsalita ang Panginoon kay Moises, na sinasabi,"
Leviticus,23,34,“Iyong sabihin ang ganito sa mga anak ni Israel: Sa ikalabinlimang araw ng ikapitong buwang ito ay pitong araw na Kapistahan ng mga Kubol sa Panginoon .
Leviticus,23,35,Ang unang araw ay isang banal na pagpupulong; kayo'y huwag gagawa ng anumang mabigat na gawain.
Leviticus,23,36,Pitong araw na maghahandog kayo sa Panginoon ng handog na pinaraan sa apoy. Sa ikawalong araw ay magkakaroon kayo ng banal na pagpupulong; at kayo'y maghahandog sa Panginoon ng handog na pinaraan sa apoy. Ito ay isang taimtim na pagtitipon; huwag kayong gagawa ng anumang mabigat na gawain.
Leviticus,23,37,"“Ito ang mga takdang kapistahan sa Panginoon na inyong ipahahayag bilang mga banal na pagpupulong, upang maghandog sa Panginoon ng handog na pinaraan sa apoy, ng handog na sinusunog, ng butil na handog, at ng mga inuming handog, na bawat isa ay sa nararapat na araw;"
Leviticus,23,38,"bukod sa mga Sabbath sa Panginoon , at bukod sa inyong mga kaloob, bukod sa lahat ng inyong panata, bukod sa lahat ng inyong mga kusang-loob na handog na inyong ibibigay sa Panginoon ."
Leviticus,23,39,"“Gayundin, sa ikalabinlimang araw ng ikapitong buwan, kapag inyong tinipon ang bunga ng lupain, ipagdiriwang ninyo ang mga kapistahan ng Panginoon sa loob ng pitong araw; ang una at ikawalong araw ay Sabbath."
Leviticus,23,40,"Sa unang araw ay magdadala kayo ng bunga ng magagandang punungkahoy, ng mga sanga ng mga palma, mga sanga ng mayayabong na punungkahoy, at ng maliliit na halaman sa batis; at kayo'y magdiriwang sa harapan ng Panginoon ninyong Diyos sa loob ng pitong araw."
Leviticus,23,41,Inyong tutuparin ito bilang isang kapistahan sa Panginoon sa loob ng pitong araw sa bawat taon. Ito ay isang tuntunin magpakailanman sa buong panahon ng inyong salinlahi; sa ikapitong buwan ay ipagdiriwang ninyo ang kapistahang ito.
Leviticus,23,42,"Kayo'y maninirahan sa mga kubol sa loob ng pitong araw; ang lahat ng katutubo sa Israel ay maninirahan sa mga kubol,"
Leviticus,23,43,upang malaman ng inyong salinlahi na pinatira ko sa mga kubol ang mga anak ni Israel nang sila'y aking ilabas sa lupain ng Ehipto: Ako ang Panginoon ninyong Diyos.”
Leviticus,23,44,Gayon ipinahayag ni Moises ang mga takdang kapistahan ng Panginoon sa bayan ng Israel.
Leviticus,24,1,"At nagsalita ang Panginoon kay Moises, na sinasabi,"
Leviticus,24,2,"“Iutos mo sa mga anak ni Israel na dalhan ka nila ng dalisay na langis ng olibo na hinalo para sa ilawan, upang patuloy na magningas ang ilawan."
Leviticus,24,3,"Sa labas ng tabing ng patotoo, sa toldang tipanan, ito ay laging aayusin ni Aaron, mula hapon hanggang sa umaga sa harapan ng Panginoon . Ito'y isang tuntunin magpakailanman sa buong panahon ng inyong salinlahi."
Leviticus,24,4,Aayusin niyang palagi ang mga ilaw sa ibabaw ng ilawan na yari sa lantay na ginto sa harapan ng Panginoon . Ang Tinapay na Handog sa Diyos
Leviticus,24,5,"“Kukuha ka ng piling harina, at sa pamamagitan nito ay magluluto ka ng labindalawang tinapay; dalawang ikasampung bahagi ng efa ang sa bawat tinapay."
Leviticus,24,6,"Ilalagay mo ang mga iyon sa dalawang hanay, anim sa bawat hanay, sa ibabaw ng hapag na dalisay na ginto."
Leviticus,24,7,"Maglalagay ka sa bawat hanay ng dalisay na kamanyang, upang maging handog na tanda para sa tinapay bilang handog na pinaraan sa apoy para sa Panginoon ."
Leviticus,24,8,"Sa bawat Sabbath ay palaging aayusin ito ni Aaron sa harapan ng Panginoon para sa mga anak ni Israel, bilang isang tungkuling walang hanggan."
Leviticus,24,9,"Ito ay magiging kay Aaron at sa kanyang mga anak, at ito ay kanilang kakainin sa dakong banal, sapagkat ito ay kabanal-banalang bahagi para sa kanya mula sa mga handog sa Panginoon na pinaraan sa apoy, isang walang hanggang bahagi.” Isang Halimbawa ng Makatarungang Pagpaparusa"
Leviticus,24,10,"Noon, ang anak na lalaki ng isang babaing Israelita na ang ama'y Ehipcio ay pumunta sa mga anak ni Israel. Nag-away sa kampo ang anak ng babaing Israelita at ang isang Israelita."
Leviticus,24,11,"At nilapastangan ng anak ng babaing Israelita ang Pangalan, sa isang pagsumpa. Siya'y kanilang dinala kay Moises, at ang pangalan ng kanyang ina ay Shelomit, na anak ni Debri sa lipi ni Dan."
Leviticus,24,12,Kanilang inilagay siya sa bilangguan hanggang sa ang hatol ay ipahayag sa kanila ng Panginoon .
Leviticus,24,13,"At nagsalita ang Panginoon kay Moises, na sinasabi,"
Leviticus,24,14,"“Dalhin mo ang manlalait sa labas ng kampo; at ang lahat ng nakarinig sa kanya ay magpatong ng kanilang mga kamay sa kanyang ulo, at hayaang batuhin siya ng buong kapulungan."
Leviticus,24,15,"At sasabihin mo sa mga anak ni Israel, “Sinumang lumait sa kanyang Diyos ay mananagot sa kanyang kasalanan."
Leviticus,24,16,Ang lumapastangan sa pangalan ng Panginoon ay tiyak na papatayin; at babatuhin siya ng buong kapulungan; maging dayuhan o katutubo sa lupain ay papatayin kapag nilapastangan ang Pangalan.
Leviticus,24,17,"Sinumang pumatay ng tao ay papatayin,"
Leviticus,24,18,at ang pumatay ng hayop ay magpapalit nito; buhay sa buhay.
Leviticus,24,19,"Kapag pininsala ng sinuman ang kanyang kapwa, gaya ng kanyang ginawa ay gayundin ang gagawin sa kanya,"
Leviticus,24,20,"bali sa bali, mata sa mata, ngipin sa ngipin; ayon sa kanyang pagkapinsala sa tao, siya ay pipinsalain."
Leviticus,24,21,Ang pumatay ng isang hayop ay magpapalit nito at ang pumatay ng isang tao ay papatayin.
Leviticus,24,22,Magkakaroon kayo ng isa lamang batas para sa dayuhan at para sa katutubo; sapagkat ako ang Panginoon ninyong Diyos.”
Leviticus,24,23,"Nagsalita ng gayon si Moises sa mga anak ni Israel, at kanilang dinala ang taong nanlait sa labas ng kampo, at siya'y pinagbabato. At ginawa ng mga anak ni Israel ang ayon sa iniutos ng Panginoon kay Moises."
Leviticus,25,1,"At nagsalita ang Panginoon kay Moises sa bundok ng Sinai, na sinasabi,"
Leviticus,25,2,"“Magsalita ka sa mga anak ni Israel, at sabihin mo sa kanila: Pagdating ninyo sa lupaing ibinibigay ko sa inyo, ang lupain ay mangingilin ng isang Sabbath sa Panginoon ."
Leviticus,25,3,"Anim na taong hahasikan mo ang iyong bukid, at anim na taong pupungusan mo ang iyong ubasan, at titipunin mo ang kanyang bunga."
Leviticus,25,4,"Subalit ang ikapitong taon ay magiging ganap na kapahingahan sa lupain, isang Sabbath sa Panginoon ; huwag mong hahasikan ang iyong bukid, ni pupungusan ang iyong ubasan."
Leviticus,25,5,"Huwag mong aanihin ang kusang tumubo sa iyong inanihan, at huwag mong titipunin ang mga ubas ng iyong ubasan na hindi mo inalagaan; iyon ay magiging taon ng ganap na kapahingahan sa lupain."
