book,chapter,verse_number,text
Leviticus,11,40,"at ang kumain ng bangkay nito ay maglalaba ng kanyang damit, at magiging marumi hanggang sa paglubog ng araw; at ang bumuhat ng bangkay nito ay maglalaba ng kanyang damit, at magiging marumi hanggang sa paglubog ng araw."
Leviticus,11,41,“Bawat umuusad sa ibabaw ng lupa ay marumi; hindi ito maaaring kainin.
Leviticus,11,42,"Anumang lumalakad sa pamamagitan ng kanyang tiyan, at lahat ng lumalakad sa pamamagitan ng apat na paa, at anumang mayroong maraming paa, maging sa lahat ng bagay na umuusad sa ibabaw ng lupa, ay huwag ninyong kakainin; sapagkat ang mga ito ay marumi."
Leviticus,11,43,"Huwag ninyong gawing karumaldumal ang inyong sarili sa pamamagitan ng anumang umuusad ni gawin ninyong marumi ang inyong sarili sa pamamagitan ng mga iyan, upang huwag kayong marumihan nila."
Leviticus,11,44,"Sapagkat ako ang Panginoon ninyong Diyos, kaya't pakabanalin ninyo ang inyong mga sarili, at kayo'y maging banal, sapagkat ako ay banal. Huwag ninyong durungisan ang inyong mga sarili sa pamamagitan ng anumang umuusad sa ibabaw ng lupa."
Leviticus,11,45,"Sapagkat ako ang Panginoon na naglabas sa inyo mula sa lupain ng Ehipto, upang maging inyong Diyos; kayo nga'y magpakabanal, sapagkat ako'y banal.”"
Leviticus,11,46,"Ito ang batas tungkol sa hayop, sa ibon, at sa lahat na may buhay na gumagalaw na nasa tubig, at sa lahat ng nilikha na umuusad sa ibabaw ng lupa,"
Leviticus,11,47,"upang bigyan ng pagkakaiba ang marumi at ang malinis, at ang may buhay na maaaring kainin at ang may buhay na hindi maaaring kainin."
Leviticus,12,1,"Ang Panginoon ay nagsalita kay Moises, na sinasabi,"
Leviticus,12,2,"“Sabihin mo sa mga anak ni Israel: Kung ang isang babae ay maglihi, at manganak ng isang lalaki, siya ay magiging marumi sa loob ng pitong araw; kagaya nang sa mga araw ng kanyang pagkakaroon ng regla, siya ay magiging marumi."
Leviticus,12,3,At sa ikawalong araw ang bata ay tutuliin.
Leviticus,12,4,"Siya'y magpapatuloy sa panahon ng kanyang paglilinis sa dugo sa loob ng tatlumpu't tatlong araw; huwag siyang hihipo ng anumang bagay na banal, at huwag siyang papasok sa santuwaryo, hanggang sa matapos ang mga araw ng kanyang paglilinis."
Leviticus,12,5,"Ngunit kung manganak siya ng babae, siya ay magiging marumi sa loob ng dalawang linggo, gaya ng sa kanyang panahon ng pagkakaroon ng regla; siya'y magpapatuloy sa panahon ng kanyang paglilinis sa dugo sa loob ng animnapu't anim na araw."
Leviticus,12,6,"“Kapag ang mga araw ng kanyang paglilinis ay matapos na, maging sa anak na lalaki o sa anak na babae, siya ay magdadala sa paring nasa pintuan ng toldang tipanan ng isang taong gulang na kordero bilang handog na sinusunog, at isang batang kalapati o isang batu-bato bilang handog pangkasalanan."
Leviticus,12,7,"Ihahandog ito ng pari sa harapan ng Panginoon , at itutubos para sa kanya; at siya'y malilinis sa agos ng kanyang dugo. Ito ang batas tungkol sa kanya na nanganak, maging ng lalaki o ng babae."
Leviticus,12,8,"Kung hindi niya kayang bumili ng kordero, siya ay kukuha ng dalawang batu-bato o ng dalawang batang kalapati, ang isa'y bilang handog na sinusunog at ang isa'y handog pangkasalanan. Ang pari ay gagawa ng pagtubos para sa kanya, at siya'y magiging malinis.”"
Leviticus,13,1,Sinabi ng Panginoon kina Moises at Aaron:
Leviticus,13,2,"“Kapag ang isang tao ay nagkaroon ng pamamaga sa balat ng kanyang katawan, o langib, o kaya'y singaw, at sa balat ng kanyang katawan ay naging salot na ketong, dadalhin siya sa paring si Aaron, o sa isa sa kanyang mga anak na pari."
Leviticus,13,3,"Susuriin ng pari ang bahaging may karamdaman na nasa balat ng kanyang katawan; at kung ang balahibo sa salot ay pumuti, at ang anyo ng karamdaman ay higit na malalim kaysa balat ng kanyang katawan, ito nga ay salot na ketong. Pagkatapos na siya'y masuri ng pari, ipahahayag niya na marumi siya."
Leviticus,13,4,"Subalit kung ang pamamaga ay maputi sa balat ng kanyang katawan, at makitang ito ay hindi malalim kaysa balat, at ang balahibo niyon ay hindi pumuti, ibubukod ng pari ang may karamdaman sa loob ng pitong araw."
Leviticus,13,5,"Siya'y susuriin ng pari sa ikapitong araw, at kung makitang ang bahaging may karamdaman ay tumigil at ito ay hindi kumalat sa balat, ibubukod siyang muli ng pari sa loob ng pitong araw pa."
Leviticus,13,6,"Muli siyang susuriin ng pari sa ikapitong araw, at kung makitang ang bahaging may karamdaman ay namutla, at ang sakit ay hindi kumalat sa balat, kung gayon ay ipahahayag siya ng pari na malinis. Iyon ay isa lamang singaw at lalabhan niya ang kanyang damit, at magiging malinis."
Leviticus,13,7,"Subalit kung ang singaw ay kumakalat sa balat pagkatapos na siya'y magpakita sa pari para sa kanyang paglilinis, siya ay muling magpapakita sa pari."
Leviticus,13,8,"Siya'y susuriin ng pari, at kung ang singaw ay kumakalat na sa balat, ipahahayag ng pari na siya ay marumi; ketong nga iyon."
Leviticus,13,9,"“Kapag ang salot na ketong ay nasa isang tao, siya ay dadalhin sa pari."
Leviticus,13,10,"Siya'y susuriin ng pari, at kung may maputing pamamaga sa balat, at pumuti ang balahibo, at may buháy na laman sa pamamaga,"
Leviticus,13,11,iyon ay matagal nang ketong sa balat ng kanyang laman. Siya'y ipahahayag ng pari na marumi; hindi siya ikukulong sapagkat siya'y marumi.
Leviticus,13,12,"At kung kumalat ang ketong sa balat, at ang ketong ay bumalot sa buong balat ng may salot, mula sa ulo hanggang sa kanyang mga paa, sa buong maaabot ng paningin ng pari;"
Leviticus,13,13,"kung gayo'y susuriin siya ng pari, at kung makitang ang ketong ay kumalat na sa kanyang buong katawan, kanyang ipahahayag na siya'y malinis na sa sakit. Yamang ito'y pumuting lahat, siya'y malinis."
Leviticus,13,14,"Subalit sa araw na makitaan siya ng lamang buháy, siya ay magiging marumi."
Leviticus,13,15,"Susuriin ng pari ang lamang buháy, at siya'y ipahahayag na marumi; ang lamang buháy ay marumi; ito ay ketong."
Leviticus,13,16,"Ngunit kapag pumuti ang lamang buháy, ay lalapit siya sa pari;"
Leviticus,13,17,"siya'y susuriin ng pari, at kung ang karamdaman ay pumuti, ang may karamdaman ay ipahahayag ng pari na malinis; siya nga'y malinis."
Leviticus,13,18,"“Kung sa balat ay may isang bukol na gumaling,"
Leviticus,13,19,"at ang humalili sa bukol ay isang pamamaga na maputi, o isang pantal na makintab na namumula, ito ay ipapakita sa pari."
Leviticus,13,20,"Susuriin ito ng pari, at kung makitang ito'y tila mas malalim kaysa balat, at ang balahibo niyon ay pumuti, ipahahayag ng pari na siya ay marumi. Ito ay sakit na ketong na lumitaw mula sa bukol."
Leviticus,13,21,"Subalit kung sa pagsusuri ng pari ay makitang walang balahibong puti iyon, o hindi malalim kaysa balat, kundi maitim-itim, siya ay ibubukod ng pari sa loob ng pitong araw."
Leviticus,13,22,"At kung ito ay kumalat sa balat, ipahahayag ng pari na siya ay marumi; iyon nga ay sakit."
Leviticus,13,23,"Ngunit kung ang pamamaga ay tumigil sa kanyang kinaroroonan, at hindi kumalat, ito ay galos ng bukol; at ipahahayag ng pari na siya ay malinis."
Leviticus,13,24,"“O kapag ang katawan ay may paso sa balat at ang laman sa paso ay naging tila mapulang-mapula, o maputi;"
Leviticus,13,25,"ito ay susuriin ng pari, at kung makitang ang buhok ay pumuti sa bahaging makintab, at tila mas malalim kaysa balat, ito ay ketong. Ito ay lumitaw sa paso, at ipahahayag ng pari na siya ay marumi; ito ay sakit na ketong."
Leviticus,13,26,"Ngunit kung sa pagsusuri ng pari ay walang balahibong maputi sa bahaging makintab at ito ay hindi mas malalim kaysa ibang balat, kundi parang maitim-itim, ibubukod siya ng pari sa loob ng pitong araw."
Leviticus,13,27,"Sa ikapitong araw ay titingnan siya ng pari, at kung ito ay kumalat na sa balat, ipahahayag ng pari na siya ay marumi. Ito ay sakit na ketong."
Leviticus,13,28,"Kung ang bahaging makintab ay nanatili sa kanyang kinaroroonan at hindi kumakalat sa balat, kundi maitim-itim, ito ay pamamaga ng paso, at ipahahayag ng pari na siya ay malinis, sapagkat iyon ay isang pilat ng paso."
Leviticus,13,29,"“At kung ang sinumang lalaki o babae ay mayroong karamdaman sa ulo o sa balbas,"
Leviticus,13,30,"ay susuriin nga ng pari ang karamdaman, at kung ang anyo ay mas malalim kaysa balat, at ang buhok doon ay madilaw at manipis, ipahahayag ng pari na siya ay marumi; ito ay pangangati na isang uri ng ketong sa ulo o sa baba."
Leviticus,13,31,"Kapag tiningnan ng pari ang makating karamdaman, at tila hindi mas malalim kaysa balat, at wala iyong buhok na maitim, ibubukod ng pari sa loob ng pitong araw ang may makating karamdaman."
Leviticus,13,32,"At sa ikapitong araw ay susuriin ng pari ang karamdaman; at kung makitang hindi kumalat ang pangangati, at walang buhok na naninilaw, at tila ang pangangati ay hindi mas malalim kaysa balat,"
Leviticus,13,33,"kung gayon ay mag-aahit siya, subalit hindi aahitan ang kinaroroonan ng pangangati, at muling ibubukod ng pari ang maysakit ng pangangati sa loob ng pitong araw."
Leviticus,13,34,"Susuriin ng pari ang pangangati sa ikapitong araw, at kung makitang hindi kumalat ang pangangati sa balat, at tila hindi mas malalim kaysa balat, ipahahayag ng pari na siya ay malinis, at siya'y maglalaba ng kanyang damit at magiging malinis."
Leviticus,13,35,"Ngunit kung ang pangangati ay kumalat na sa balat pagkatapos ng kanyang paglilinis,"
Leviticus,13,36,"ay susuriin siya ng pari, at kung kumalat na sa balat ang pangangati, hindi na hahanapin ng pari ang buhok na naninilaw; siya'y marumi."
Leviticus,13,37,"Subalit kung sa kanyang mga mata ay napigil na ang pangangati at may tumubong buhok na itim at gumaling na ang pangangati, siya'y malinis; at siya'y ipahahayag na malinis ng pari."
Leviticus,13,38,"“Kapag ang isang lalaki o babae ay nagkaroon sa balat ng nangingintab na pantal, ng mga makintab na pantal na puti,"
Leviticus,13,39,"ito ay susuriin ng pari, at kung may namumuti na nangingintab na pantal sa balat ng kanyang laman; ito ay isang singaw na sumibol sa balat; siya'y malinis."
Leviticus,13,40,"“Kapag ang buhok ng sinuman ay nalalagas mula sa kanyang ulo, siya ay kalbo, gayunma'y malinis."
Leviticus,13,41,"At kung ang kanyang buhok ay nalagas mula sa kanyang noo, siya ay kalbo mula sa noo, ngunit siya ay malinis."
Leviticus,13,42,"Subalit kung sa kalbong ulo o noo ay magkaroon ng namumula o namumuting sugat, ito ay ketong na sumibol sa kanyang kalbong ulo o sa kanyang kalbong noo."
Leviticus,13,43,"Siya'y susuriin ng pari, at kung ang pamamaga ng karamdaman ay mapula-pula na maputi sa kanyang kalbong ulo o sa kanyang kalbong noo, gaya ng anyo ng ketong sa balat ng kanyang katawan,"
Leviticus,13,44,"siya ay ketongin, siya'y marumi. Ipahahayag ng pari na siya ay marumi; ang kanyang sakit ay nasa kanyang ulo."
Leviticus,13,45,"“Ang ketonging may sakit ay magsusuot ng punit na damit, at ang buhok ng kanyang ulo ay ilulugay, at tatakpan niya ang itaas na bahagi ng kanyang nguso, at siya'y sisigaw, ‘Marumi, marumi.’"
Leviticus,13,46,Siya'y mananatiling marumi hangga't nasa kanya ang karamdaman; siya'y marumi. Siya ay maninirahang mag-isa sa labas ng kampo.
Leviticus,13,47,"“Kung alinman sa mga kasuotan ay may sakit na ketong; sa kasuotang mula sa balahibo ng tupa o kasuotang lino,"
Leviticus,13,48,"maging ito ay paayon o pahalang; o ng lino o ng balahibo ng tupa, maging sa balat o sa alinmang yari sa balat,"
Leviticus,13,49,"at kung ang salot ay nagkukulay berde o namumula sa kasuotan, o sa balat, o sa paayon, o sa pahalang, o sa alinmang kasangkapang yari sa balat; ito ay sakit na ketong at ito ay ipapakita sa pari."
Leviticus,13,50,"Susuriin ng pari ang sakit, at ibubukod ang bagay na may sakit sa loob ng pitong araw."
Leviticus,13,51,"Kanyang susuriin ang sakit sa ikapitong araw at kung kumalat na ang sakit sa kasuotan, maging sa paayon, o sa pahalang, o sa balat, o alinmang yari sa balat upang gamitin, ang salot ay isang kumakalat na ketong; iyon ay marumi."
Leviticus,13,52,"Kanyang susunugin ang kasuotan, maging paayon, at maging pahalang, ng balahibo ng tupa o lino o sa alinmang kasangkapang yari sa balat na kinaroroonan ng salot. Sapagkat iyon ay ketong na kumakalat; iyon ay susunugin sa apoy."
Leviticus,13,53,"“Kapag sinuri ng pari, at ang sakit ay hindi kumalat sa kasuotan, maging sa paayon man, o sa pahalang man, o sa alinmang kasangkapang yari sa balat,"
Leviticus,13,54,"kung gayon ay mag-uutos ang pari, at kanilang lalabhan ang kinaroroonan ng sakit, at ito ay ibubukod na muli sa loob ng pitong araw."
Leviticus,13,55,"Susuriin ng pari ang bagay na may sakit pagkatapos na malabhan; at kung makitang ang sakit ay hindi nagbago ng anyo nito, at kung hindi kumalat ang sakit, ito ay marumi. Susunugin mo ito sa apoy, maging ang bahaging may ketong ay nasa likuran o sa harapan."
Leviticus,13,56,"“Subalit kapag tiningnan ng pari, at nakitang nangitim ang dakong may sakit pagkatapos na malabhan, ito ay hahapakin mula sa kasuotan, o mula sa paayon, o mula sa pahalang."
Leviticus,13,57,"At kung ito ay nakikita pa sa kasuotang iyon, maging sa paayon, o sa pahalang, o sa alinmang yari sa balat, ito ay sakit na kumakalat; susunugin mo sa apoy ang kinaroroonan ng sakit."
Leviticus,13,58,"Ang kasuotan, maging sa paayon, o sa pahalang, o sa alinmang yari sa balat, na pinanggalingan ng sakit matapos mo itong malabhan, ay muli mong lalabhan, at magiging malinis.”"
Leviticus,13,59,"Ito ang batas tungkol sa sakit na ketong sa kasuotang balahibo ng tupa o lino, maging sa paayon, o sa pahalang, o sa alinmang yari sa balat, upang maipahayag kung ito ay malinis o marumi."
Leviticus,14,1,"At nagsalita ang Panginoon kay Moises, na sinasabi,"
Leviticus,14,2,“Ito ang magiging batas tungkol sa ketongin sa mga araw ng kanyang paglilinis. Siya'y dadalhin sa pari;
Leviticus,14,3,"at ang pari ay lalabas sa kampo at susuriin siya. Kung ang sakit na ketong ay gumaling na sa ketongin,"
Leviticus,14,4,"iuutos ng pari sa kanila na ikuha siya ng dalawang buháy na malinis na ibon, kahoy na sedro, lanang pula at isopo;"
Leviticus,14,5,at ipag-uutos ng pari sa kanila na patayin ang isa sa mga ibon sa isang sisidlang luwad sa ibabaw ng tubig na umaagos.
Leviticus,14,6,"Kukunin niya ang ibong buháy, ang kahoy na sedro, ang lanang pula at ang isopo, at itutubog ang mga ito at ang ibong buháy sa dugo ng ibong pinatay sa ibabaw ng tubig na umaagos."
Leviticus,14,7,"Iwiwisik niya nang pitong ulit sa taong lilinisin mula sa ketong; pagkatapos ay ipahahayag siya na malinis, at pakakawalan ang ibong buháy sa kalawakan ng parang."
Leviticus,14,8,"At siya na lilinisin ay maglalaba ng kanyang kasuotan at aahitin ang lahat niyang buhok, at maliligo sa tubig, at siya'y magiging malinis. Pagkatapos ay papasok siya sa kampo, subalit maninirahan sa labas ng kanyang tolda sa loob ng pitong araw."
Leviticus,14,9,"Sa ikapitong araw ay muli niyang aahitin ang lahat ng buhok: sa ulo, baba, at kilay at lahat ng buhok sa kanyang katawan. Pagkatapos ay lalabhan niya ang kanyang kasuotan, at maliligo siya sa tubig, at siya ay magiging malinis."
Leviticus,14,10,"“Sa ikawalong araw, kukuha siya ng dalawang korderong lalaki na walang kapintasan, at ng isang korderong babae na isang taong gulang at walang kapintasan, at ng ikasampung bahagi ng harinang hinaluan ng langis, isang handog at ng isang log na langis, bilang pagkaing handog."
Leviticus,14,11,Ang paring naglilinis sa taong lilinisin ay tatayo sa harapan ng Panginoon sa pintuan ng toldang tipanan kasama ng mga bagay na ito.
Leviticus,14,12,"Kukunin ng pari ang isa sa mga korderong lalaki at ihahandog bilang handog para sa budhing maysala, at ang log ng langis, at iwawagayway bilang handog na iwinawagayway sa harapan ng Panginoon ."
Leviticus,14,13,"Kanyang papatayin ang korderong lalaki sa lugar na pinagpapatayan nila ng handog pangkasalanan at ng handog na sinusunog, sa banal na dako; sapagkat gaya ng handog pangkasalanan, ang handog para sa budhing maysala ay para sa pari; ito ay kabanal-banalan."
Leviticus,14,14,"Ang pari ay kukuha ng dugo ng handog para sa budhing maysala at ilalagay niya sa dulo ng kanang tainga, sa hinlalaki ng kanang kamay, at sa hinlalaki ng kanang paa ng taong lilinisin."
Leviticus,14,15,"Pagkatapos ay kukuha ang pari ng log ng langis at ibubuhos sa ibabaw ng palad ng kanyang kaliwang kamay,"
Leviticus,14,16,"at itutubog ng pari ang kanyang kanang daliri sa langis na nasa kanyang kaliwang kamay, at iwiwisik ang langis ng pitong ulit sa pamamagitan ng kanyang daliri sa harapan ng Panginoon ."
Leviticus,14,17,"Mula sa nalabing langis na nasa kanyang kamay ay maglalagay ang pari ng dugo sa dulo ng kanang tainga, sa hinlalaki ng kanang kamay, at sa hinlalaki ng kanang paa ng taong lilinisin, sa ibabaw ng dugo ng handog para sa budhing maysala."
Leviticus,14,18,"Ang nalabing langis na nasa kamay ng pari ay ilalagay niya sa ulo ng taong lilinisin, at ang pari ay gagawa ng pagtubos para sa kanya sa harapan ng Panginoon ."
Leviticus,14,19,"Mag-aalay ang pari ng handog pangkasalanan, at itutubos sa kanya na lilinisin mula sa kanyang karumihan. Pagkatapos ay papatayin niya ang handog na sinusunog,"
Leviticus,14,20,"at iaalay ng pari ang handog na sinusunog at ang butil na handog sa ibabaw ng dambana. Gayon gagawin ng pari ang pagtubos para sa kanya, at siya'y magiging malinis."
Leviticus,14,21,"“Kung siya'y dukha at ang kanyang kakayahan ay hindi makakasapat, kukuha siya ng isang korderong lalaki na handog para sa budhing maysala bilang handog na iwinawagayway upang ipantubos sa sarili, at ng ikasampung bahagi ng harina na hinaluan ng langis bilang butil na handog, ng isang log ng langis;"
Leviticus,14,22,"at ng dalawang batu-bato o ng dalawang batang kalapati, ayon sa kanyang kaya; at ang isa ay magiging handog pangkasalanan, at ang isa'y handog na sinusunog."
Leviticus,14,23,Sa ikawalong araw ay kanyang dadalhin ang mga iyon sa pari sa pintuan ng toldang tipanan para sa kanyang paglilinis sa harapan ng Panginoon .
Leviticus,14,24,At kukunin ng pari ang korderong handog para sa budhing maysala at ang log ng langis at iwawagayway ang mga ito ng pari bilang handog na iwinawagayway sa harapan ng Panginoon .
Leviticus,14,25,"Kanyang papatayin ang korderong handog para sa budhing maysala, at kukuha ang pari ng dugo mula sa handog para sa budhing maysala, at ilalagay sa dulo ng kanang tainga, sa hinlalaki ng kanyang kanang kamay, at sa hinlalaki ng kanang paa ng taong lilinisin;"
Leviticus,14,26,at ibubuhos ng pari ang langis sa ibabaw ng palad ng kanyang kaliwang kamay.
Leviticus,14,27,Pitong ulit na iwiwisik ng pari sa pamamagitan ng kanyang kanang daliri ang langis na nasa kanyang kaliwang kamay sa harapan ng Panginoon .
Leviticus,14,28,"At ilalagay ng pari ang langis na nasa kanyang kamay sa dulo ng kanang tainga, at hinlalaki ng kanang kamay, at sa hinlalaki ng kanang paa ng taong lilinisin sa ibabaw ng pinaglagyan ng dugo ng handog para sa budhing maysala."
Leviticus,14,29,"Ang nalabing langis na nasa kamay ng pari ay ilalagay niya sa ulo ng taong lilinisin, upang ipantubos sa kanya sa harapan ng Panginoon ."
Leviticus,14,30,"At kanyang ihahandog ang isa sa mga batu-bato o sa mga inakay ng kalapati, kung alin ang kanyang kaya."
Leviticus,14,31,"Kung alin ang abot ng kanyang kaya, ang isa'y handog pangkasalanan, at ang isa'y handog na sinusunog, bukod sa butil na handog. At ang pari ay gagawa ng pagtubos sa harapan ng Panginoon para sa kanya na lilinisin."
Leviticus,14,32,Ito ang batas tungkol sa may sakit na ketong na hindi kayang bumili ng mga handog para sa kanyang paglilinis.” Ang Paglilinis ng mga Bahay na may Sakit
Leviticus,14,33,Sinabi ng Panginoon kina Moises at Aaron:
Leviticus,14,34,"“Pagdating ninyo sa lupain ng Canaan na aking ibinigay sa inyo bilang pag-aari, at ako'y naglagay ng sakit na ketong sa isang bahay sa lupaing inyong pag-aari,"
Leviticus,14,35,"ang may-ari ng bahay ay lalapit sa pari at sasabihin, ‘Mayroon yatang isang uri ng sakit sa aking bahay.’"
Leviticus,14,36,"Ipag-uutos ng pari na alisan ng laman ang bahay bago siya pumasok upang tingnan ang sakit, upang ang lahat na nasa bahay ay huwag maging marumi; at pagkatapos ay papasok ang pari upang tingnan ang bahay."
Leviticus,14,37,"Kanyang susuriin ang salot, at kung ang salot ay nasa mga dingding ng bahay na nagkukulay berde, o namumula ng batik at ang anyo nito ay mas malalim kaysa dingding,"
Leviticus,14,38,kung gayon ay lalabas ang pari sa bahay tungo sa pintuan ng bahay at isasara ang bahay sa loob ng pitong araw.
Leviticus,14,39,"Muling babalik ang pari sa ikapitong araw at gagawa ng pagsusuri, at kung kumalat na ang salot sa mga dingding ng bahay,"
Leviticus,14,40,ay ipag-uutos nga ng pari na alisin ang mga batong kinaroroonan ng salot at itapon ang mga iyon sa isang dakong marumi sa labas ng bayan.
Leviticus,14,41,"Kanyang ipakakayod ang palibot ng loob ng bahay, at kanilang ibubuhos ang duming kinayod sa labas ng bayan, sa isang dakong marumi;"
Leviticus,14,42,"at sila'y kukuha ng ibang mga bato, at ihahalili sa mga batong iyon, at kukuha ng ibang pampalitada para sa bahay."
Leviticus,14,43,"“Kung muling bumalik ang salot, at lumitaw sa bahay pagkatapos na maalis ang mga bato at pagkatapos ipakayod ang bahay, at pagkatapos na mapalitadahan,"
Leviticus,14,44,"ay papasok ang pari at magsisiyasat. Kung ang salot ay kumalat na sa bahay, ito ay ketong na nakakasira sa bahay; ito'y marumi."
Leviticus,14,45,"Gigibain niya ang bahay, ang mga bato at ang mga kahoy, at ang lahat ng palitada ng bahay, at kanyang dadalhin sa labas ng bayan, sa isang dakong marumi."
Leviticus,14,46,Ang pumasok sa bahay sa lahat ng mga araw na ito'y ipinasara ay magiging marumi hanggang sa paglubog ng araw.
Leviticus,14,47,At ang mahiga sa bahay na iyon ay maglalaba ng kanyang mga damit; at ang kumain sa bahay na iyon ay maglalaba ng kanyang mga damit.
Leviticus,14,48,"“Subalit kapag pumasok ang pari at maingat na tiningnan ito at ang salot ay hindi na kumalat sa bahay pagkatapos na mapalitadahan, ipahahayag ng pari na malinis ang bahay, sapagkat ang sakit ay napagaling na."
Leviticus,14,49,"Kukuha siya ng dalawang ibon para sa paglilinis ng bahay, ng kahoy na sedro, ng pulang sinulid, at ng isopo,"
Leviticus,14,50,"at papatayin ang isa sa mga ibon sa isang sisidlang lupa sa ibabaw ng tubig na umaagos,"
Leviticus,14,51,"at kukunin niya ang kahoy na sedro, at ang isopo, at ang pulang sinulid, at ang ibong buháy, at ilulubog ang mga ito sa dugo ng ibong pinatay, at sa tubig na umaagos, at iwiwisik ng pitong ulit sa bahay."
Leviticus,14,52,"Gayon niya lilinisin ang bahay sa pamamagitan ng dugo ng ibon, ng agos ng tubig, ng ibong buháy, ng kahoy na sedro, ng isopo, at ng pulang sinulid;"
Leviticus,14,53,"at kanyang pakakawalan ang ibong buháy sa labas ng bayan, sa kaparangan, at matutubos ang bahay; at ito ay magiging malinis.”"
Leviticus,14,54,"Ito ang batas para sa bawat sari-saring sakit na ketong, sa pangangati;"
Leviticus,14,55,"sa ketong ng kasuotan at ng bahay,"
Leviticus,14,56,"at sa pamamaga, sa singaw, at sa batik na makintab;"
Leviticus,14,57,"upang ipakita kung kailan marumi, at kung kailan malinis. Ito ang batas tungkol sa ketong."
Leviticus,15,1,"Sinabi ng Panginoon kina Moises at Aaron,"
Leviticus,15,2,"“Magsalita kayo sa mga anak ni Israel, at inyong sabihin sa kanila: Kapag ang isang lalaki ay mayroong tulo mula sa kanyang katawan, siya ay marumi dahil sa kanyang tulo."
Leviticus,15,3,"At ito ang batas tungkol sa kanyang pagiging marumi dahil sa kanyang tulo. Maging ang kanyang katawan ay may tulo, o huminto na ang tulo sa kanyang katawan, ito ay karumihan sa kanya."
Leviticus,15,4,Bawat higaang mahigaan ng may tulo ay magiging marumi; at bawat bagay na kanyang maupuan ay magiging marumi.
Leviticus,15,5,"At sinumang humipo ng kanyang higaan ay maglalaba ng kanyang mga damit, at maliligo siya sa tubig, at magiging marumi hanggang sa paglubog ng araw."
Leviticus,15,6,"Ang umupo sa anumang bagay na inupuan ng may tulo ay maglalaba ng kanyang mga damit, at maliligo siya sa tubig, at magiging marumi hanggang sa paglubog ng araw."
Leviticus,15,7,"Ang humipo ng katawan ng may tulo ay maglalaba ng kanyang mga damit at maliligo siya sa tubig, at magiging marumi hanggang sa paglubog ng araw."
Leviticus,15,8,"Kung ang may tulo ay lumura sa taong malinis, maglalaba siya ng kanyang mga damit, at maliligo siya sa tubig, magiging marumi siya hanggang sa paglubog ng araw."
Leviticus,15,9,Ang bawat upuang sapin na sakyan ng may tulo ay magiging marumi.
Leviticus,15,10,"Sinumang taong humipo ng alinmang bagay na nasa ilalim niya, ay magiging marumi hanggang sa paglubog ng araw; at ang magdala ng mga bagay na iyon ay maglalaba ng kanyang mga damit at maliligo siya sa tubig, at magiging marumi hanggang sa paglubog ng araw."
Leviticus,15,11,"Sinumang mahipo ng may tulo na hindi nakapaghugas ng kanyang mga kamay sa tubig, maglalaba ng kanyang mga damit, at maliligo siya sa tubig, at magiging marumi hanggang sa paglubog ng araw."
Leviticus,15,12,"Ang sisidlang-lupa na mahipo ng may tulo ay babasagin, at ang lahat ng sisidlang-kahoy ay babanlawan ng tubig."
Leviticus,15,13,"“At kapag ang may tulo ay luminis na sa kanyang tulo ay bibilang siya ng pitong araw sa kanyang paglilinis, at maglalaba ng kanyang mga damit. Paliliguan din niya ang kanyang katawan sa tubig na umaagos, at magiging malinis."
Leviticus,15,14,"Sa ikawalong araw ay magdadala siya ng dalawang batu-bato, o ng dalawang batang kalapati, at haharap siya sa Panginoon sa pasukan ng toldang tipanan, at ibibigay niya ang mga ito sa pari."
Leviticus,15,15,"Ihahandog ng pari ang mga ito, ang isa'y handog pangkasalanan, at ang isa'y handog na sinusunog at ang pari ay gagawa ng pagtubos para sa kanya sa harapan ng Panginoon , dahil sa kanyang tulo."
Leviticus,15,16,"“Kung ang isang lalaki ay nilalabasan ng binhi, paliliguan niya ng tubig ang kanyang buong katawan, at magiging marumi hanggang sa paglubog ng araw."
